{
	"name": "examplemod",
	"version": "1.0.0",
	"game_version": "beta-1.7.3",
	"authors": [
		"MyNameIsTrez"
	],
	"repository": {
		"url": "https://github.com/grug-lang/grug-for-minecraft"
	},
	"licenses": [
		{
			"name": "BSD Zero Clause License",
			"url": "https://spdx.org/licenses/0BSD.html"
		}
	]
}